{
  "cloud": {
    "auth_type": "ES256",
    "resource_type": "GATEWAY"
  },
  "gateway": {
    "proxy_ids": [
      "AHU-22",
      "SNS-4",
      "SNS-8"
    ]
  },
  "localnet": {
    "families": {
      "vendor": {
        "addr": "20231"
      }
    },
    "networks": {
      "modbus_rtu_1": {
        "adjunct": {
          "baud": "9600",
          "data_bits": "8",
          "device": "COM1",
          "parity": "none",
          "protocol": "RTU",
          "stop_bits": "1"
        },
        "family": "modbus"
      }
    }
  },
  "pointset": {
    "points": {
      "globulating_globar": {
        "units": "Bars"
      }
    },
    "sample_rate_sec": 30
  },
  "system": {
    "location": {
      "section": "2-3N8C",
      "site": "ZZ-TRI-FECTA"
    },
    "min_loglevel": 300,
    "node_type": "cloud_gateway",
    "physical_tag": {
      "asset": {
        "guid": "drw://TBB",
        "name": "GAT-123",
        "site": "ZZ-TRI-FECTA"
      }
    }
  },
  "timestamp": "2020-05-01T13:39:07Z",
  "upgraded_from": "1.5.2",
  "version": "1.5.3"
}
